{
  "$schema": "https://json-schema.org/draft/2020-12/schema",
  "$id": "trip-site-v1",
  "type": "object",
  "required": ["schema_version", "trip_id", "slug", "publication_status", "theme_id", "media_manifest", "features", "output_path"],
  "properties": {
    "schema_version": {"const": "trip-site-v1"},
    "trip_id": {"type": "string", "minLength": 1},
    "slug": {"type": "string", "pattern": "^[a-z0-9][a-z0-9-]*$"},
    "publication_status": {"enum": ["preview", "published", "archived"]},
    "theme_id": {"type": "string", "minLength": 1},
    "media_manifest": {"type": "string", "minLength": 1},
    "features": {"type": "object", "additionalProperties": {"type": "boolean"}},
    "output_path": {"type": "string", "minLength": 1},
    "trip_file": {"type": "string"},
    "pwa": {"type": "object"},
    "seo": {"type": "object"},
    "title_override": {"type": "string"}
  },
  "additionalProperties": false
}
