{
  "schema_version": "trip-site-v1",
  "trip_id": "kyushu-family-2026",
  "slug": "kyushu-2026",
  "publication_status": "preview",
  "theme_id": "snow-kyushu",
  "media_manifest": "site-media.json",
  "features": {"itinerary": true, "driving": true, "conditions": false, "local_planner": false},
  "pwa": {"name": "Kyushu 2026", "scope": "/trips/kyushu-2026/"},
  "seo": {"title": "九州五天四夜親子自駕", "description": "Recorded Japan trip fixture preview。"},
  "output_path": "trips/kyushu-2026/",
  "trip_file": "trip.json"
}
